{
  "$schema": "https://json-schema.org/draft/2020-12/schema",
  "$id": "https://pankusdesk.local/schemas/textbook-questions.schema.json",
  "$comment": "Design Lock v2: prescribed textbook wording plus source-backed PankusDesk study answers and source-gap handling.",
  "title": "PankusDesk Prescribed Textbook Questions — Design Lock v2",
  "type": "object",
  "additionalProperties": true,
  "required": [
    "schema_version",
    "subject_code",
    "source",
    "units"
  ],
  "properties": {
    "schema_version": {
      "type": "integer",
      "minimum": 1
    },
    "subject_code": {
      "type": "string",
      "minLength": 1
    },
    "source": {
      "type": "object",
      "required": [
        "type",
        "title"
      ],
      "additionalProperties": true,
      "properties": {
        "type": {
          "type": "string",
          "minLength": 1
        },
        "title": {
          "type": "string",
          "minLength": 1
        },
        "note": {
          "type": "string"
        }
      }
    },
    "units": {
      "type": "object",
      "additionalProperties": {
        "$ref": "#/$defs/unitQuestions"
      }
    }
  },
  "$defs": {
    "figure": {
      "type": "object",
      "additionalProperties": true,
      "required": [
        "src",
        "alt"
      ],
      "properties": {
        "src": {
          "type": "string",
          "minLength": 1
        },
        "alt": {
          "type": "string",
          "minLength": 8
        },
        "caption": {
          "type": "string"
        },
        "page": {
          "type": "integer",
          "minimum": 1
        },
        "width": {
          "type": "integer",
          "minimum": 1
        },
        "height": {
          "type": "integer",
          "minimum": 1
        }
      }
    },
    "table": {
      "type": "object",
      "additionalProperties": false,
      "required": [
        "headers",
        "rows"
      ],
      "properties": {
        "headers": {
          "type": "array",
          "items": {
            "type": "string"
          }
        },
        "rows": {
          "type": "array",
          "items": {
            "type": "array",
            "items": {
              "type": "string"
            }
          }
        }
      }
    },
    "answer": {
      "type": "object",
      "additionalProperties": true,
      "properties": {
        "status": {
          "type": "string"
        },
        "paragraphs": {
          "type": "array",
          "items": {
            "type": "string"
          }
        },
        "paragraphs_after": {
          "type": "array",
          "items": {
            "type": "string"
          }
        },
        "bullets": {
          "type": "array",
          "items": {
            "type": "string"
          }
        },
        "equations": {
          "type": "array",
          "items": {
            "type": "string"
          }
        },
        "steps": {
          "type": "array",
          "items": {
            "type": "string"
          }
        },
        "result": {
          "type": "string",
          "description": "Final answer/result shown in bold at the end of the worked solution, before any separate printed-book check."
        },
        "note": {
          "type": "string"
        },
        "book_check": {
          "type": "string"
        },
        "diagram": {
          "type": "string"
        },
        "table": {
          "$ref": "#/$defs/table"
        },
        "figures": {
          "type": "array",
          "items": {
            "$ref": "#/$defs/figure"
          }
        },
        "parts": {
          "type": "array",
          "items": {
            "type": "object",
            "additionalProperties": true,
            "required": [
              "label"
            ],
            "properties": {
              "label": {
                "type": "string",
                "minLength": 1
              },
              "paragraphs": {
                "type": "array",
                "items": {
                  "type": "string"
                }
              },
              "paragraphs_after": {
                "type": "array",
                "items": {
                  "type": "string"
                }
              },
              "bullets": {
                "type": "array",
                "items": {
                  "type": "string"
                }
              },
              "equations": {
                "type": "array",
                "items": {
                  "type": "string"
                }
              },
              "steps": {
                "type": "array",
                "items": {
                  "type": "string"
                }
              },
              "result": {
                "type": "string",
                "description": "Final answer/result for this labelled part; render prominently and in bold when present."
              },
              "note": {
                "type": "string"
              },
              "book_check": {
                "type": "string"
              },
              "diagram": {
                "type": "string"
              },
              "table": {
                "$ref": "#/$defs/table"
              },
              "figures": {
                "type": "array",
                "items": {
                  "$ref": "#/$defs/figure"
                }
              }
            }
          }
        }
      },
      "minProperties": 1
    },
    "question": {
      "type": "object",
      "additionalProperties": true,
      "required": [
        "id",
        "number",
        "book_page",
        "question",
        "answer"
      ],
      "properties": {
        "id": {
          "type": "string",
          "minLength": 1
        },
        "number": {
          "type": "integer",
          "minimum": 1
        },
        "book_page": {
          "type": "integer",
          "minimum": 1
        },
        "topic_id": {
          "type": "string"
        },
        "question": {
          "type": "string",
          "minLength": 1
        },
        "r25_scope": {
          "type": "string"
        },
        "answer": {
          "$ref": "#/$defs/answer"
        },
        "answer_basis": {
          "type": "array",
          "items": {
            "type": "string"
          },
          "uniqueItems": true
        },
        "answer_source_refs": {
          "type": "array",
          "items": {
            "type": "string"
          },
          "uniqueItems": true
        },
        "question_lead": {
          "type": "string"
        },
        "question_parts": {
          "type": "array",
          "items": {
            "type": "object",
            "additionalProperties": false,
            "required": [
              "label",
              "content"
            ],
            "properties": {
              "label": {
                "type": "string",
                "minLength": 1
              },
              "content": {
                "type": "string",
                "minLength": 1
              },
              "id": {
                "type": "string",
                "minLength": 1,
                "description": "Stable deep-link anchor for this labelled subpart."
              }
            }
          }
        },
        "math_mismatch": {
          "$ref": "#/$defs/mathMismatch"
        }
      }
    },
    "group": {
      "type": "object",
      "additionalProperties": true,
      "required": [
        "id",
        "title",
        "questions"
      ],
      "properties": {
        "id": {
          "type": "string",
          "minLength": 1
        },
        "title": {
          "type": "string",
          "minLength": 1
        },
        "questions": {
          "type": "array",
          "items": {
            "$ref": "#/$defs/question"
          }
        }
      }
    },
    "unitQuestions": {
      "type": "object",
      "additionalProperties": true,
      "required": [
        "title",
        "groups"
      ],
      "properties": {
        "title": {
          "type": "string",
          "minLength": 1
        },
        "summary": {
          "type": "object",
          "additionalProperties": true
        },
        "scope_note": {
          "type": "string"
        },
        "groups": {
          "type": "array",
          "items": {
            "$ref": "#/$defs/group"
          }
        },
        "source": {
          "type": "object",
          "additionalProperties": true
        }
      }
    },
    "mathMismatch": {
      "type": "object",
      "additionalProperties": false,
      "required": [
        "message"
      ],
      "properties": {
        "label": {
          "type": "string",
          "minLength": 1
        },
        "message": {
          "type": "string",
          "minLength": 1,
          "description": "Student-facing explanation of a verified mathematical source mismatch and why the retained/corrected solution is justified."
        },
        "affected_parts": {
          "type": "array",
          "items": {
            "type": "string",
            "minLength": 1
          },
          "uniqueItems": true,
          "description": "Optional labelled subparts, e.g. (ii), whose part labels should receive the mismatch highlight."
        }
      }
    }
  }
}
