{
  "schema_version": 3,
  "subject_code": "25ES1EE101",
  "source": {
    "type": "prescribed-textbook",
    "title": "Basics of Electrical Energy for Engineers",
    "note": "Chapter-end review questions with PankusDesk study solutions."
  },
  "units": {
    "1": {
      "title": "Introduction to Electrical Energy and DC Circuits",
      "summary": {
        "official_question_count": 26,
        "short_answer_count": 16,
        "essay_count": 10,
        "answered_from_current_unit_sources": 23,
        "outside_current_r25_source_set": 3,
        "essay_answers_expanded_for_six_marks": 9,
        "essay_source_gaps": 1,
        "answer_provenance": "PankusDesk study solution"
      },
      "scope_note": "The official Chapter 1 review contains 26 questions. Short Q15–Q16 and Essay Q10 concern transient material from textbook pp.63–69. Those pages were intentionally excluded from the supplied R25 Unit I capture, so these three questions are retained for completeness but no model-written answer is inserted.",
      "groups": [
        {
          "id": "short-answer",
          "title": "Short Answer (Two marks) Questions",
          "questions": [
            {
              "id": "u1-sa-01",
              "number": 1,
              "book_page": 70,
              "topic_id": "u1-electrical-energy",
              "question": "List the advantages of electrical energy over other forms of energy.",
              "answer": {
                "bullets": [
                  "It is convenient because it can be converted readily into light, heat, cooling and mechanical motion.",
                  "It is easily controllable: electrically operated equipment can be started, stopped and regulated conveniently.",
                  "It is economical and suitable for domestic, commercial and industrial loads.",
                  "It is clean at the point of use because utilisation itself does not produce smoke or fumes.",
                  "It can be transmitted from the generating location to distant load centres."
                ]
              },
              "answer_basis": [
                "u1-electrical-energy"
              ]
            },
            {
              "id": "u1-sa-02",
              "number": 2,
              "book_page": 70,
              "topic_id": "u1-electrical-energy",
              "question": "Define an electric generator and an electric motor.",
              "answer": {
                "bullets": [
                  "Electric generator: an electrical machine that converts mechanical energy into electrical energy.",
                  "Electric motor: an electrical machine that converts electrical energy into mechanical energy."
                ]
              },
              "answer_basis": [
                "u1-electrical-energy"
              ]
            },
            {
              "id": "u1-sa-03",
              "number": 3,
              "book_page": 70,
              "topic_id": "u1-circuit-concept",
              "question": "What is an electric circuit?",
              "answer": {
                "paragraphs": [
                  "An electric circuit is an interconnection of electrical elements arranged so that at least one closed conducting path exists for current. A basic circuit contains a source, load, connecting conductors and usually a control such as a switch."
                ]
              },
              "answer_basis": [
                "u1-circuit-concept"
              ]
            },
            {
              "id": "u1-sa-04",
              "number": 4,
              "book_page": 70,
              "topic_id": "u1-circuit-concept",
              "question": "Compare electric and magnetic circuits.",
              "answer": {
                "paragraphs": [
                  "Electric and magnetic circuits can be treated as analogous systems."
                ],
                "table": {
                  "headers": [
                    "Electric circuit",
                    "Magnetic circuit"
                  ],
                  "rows": [
                    [
                      "EMF (V) provides the driving force",
                      "MMF = NI (ampere-turns) provides the driving force"
                    ],
                    [
                      "Current I is the through quantity",
                      "Magnetic flux Φ is the corresponding through quantity"
                    ],
                    [
                      "Resistance R opposes current",
                      "Reluctance opposes magnetic flux"
                    ],
                    [
                      "For a resistive circuit, I = V/R",
                      "For a magnetic circuit, Φ = MMF/Reluctance"
                    ]
                  ]
                }
              },
              "answer_basis": [
                "u1-circuit-concept"
              ]
            },
            {
              "id": "u1-sa-05",
              "number": 5,
              "book_page": 70,
              "topic_id": "u1-rlc",
              "question": "Name the basic circuit parameters.",
              "answer": {
                "paragraphs": [
                  "The three basic passive circuit parameters are resistance (R), inductance (L) and capacitance (C)."
                ]
              },
              "answer_basis": [
                "u1-rlc"
              ]
            },
            {
              "id": "u1-sa-06",
              "number": 6,
              "book_page": 70,
              "topic_id": "u1-rlc",
              "question": "Differentiate between resistance and inductance.",
              "answer": {
                "table": {
                  "headers": [
                    "Resistance",
                    "Inductance"
                  ],
                  "rows": [
                    [
                      "Opposes current and dissipates absorbed electrical energy mainly as heat.",
                      "Opposes change in current and stores energy in a magnetic field."
                    ],
                    [
                      "For a linear resistor: v = Ri.",
                      "For an ideal inductor: v = L·di/dt."
                    ],
                    [
                      "Unit: ohm (Ω).",
                      "Unit: henry (H)."
                    ],
                    [
                      "Power is dissipated: p = i²R = v²/R.",
                      "Stored energy: W = ½Li²."
                    ]
                  ]
                }
              },
              "answer_basis": [
                "u1-rlc"
              ]
            },
            {
              "id": "u1-sa-07",
              "number": 7,
              "book_page": 70,
              "topic_id": "u1-rlc",
              "question": "How does an inductor behave in a DC circuit?",
              "answer": {
                "paragraphs": [
                  "For steady DC, current is constant, so di/dt = 0. Hence vL = L·di/dt = 0. An ideal inductor therefore behaves as a short circuit after DC steady state has been reached."
                ],
                "note": "The switching transient itself is not part of the current R25 Unit I source set."
              },
              "answer_basis": [
                "u1-rlc"
              ]
            },
            {
              "id": "u1-sa-08",
              "number": 8,
              "book_page": 70,
              "topic_id": "u1-rlc",
              "question": "Write the expression for energy stored in a capacitor.",
              "answer": {
                "equations": [
                  "W_C = ½CV²"
                ],
                "paragraphs": [
                  "Thus the energy stored in the electric field of a capacitor is one-half of C times the square of the capacitor voltage."
                ]
              },
              "answer_basis": [
                "u1-rlc"
              ]
            },
            {
              "id": "u1-sa-09",
              "number": 9,
              "book_page": 70,
              "topic_id": "u1-rlc",
              "question": "How does a capacitor behave in a DC circuit?",
              "answer": {
                "paragraphs": [
                  "For steady DC, capacitor voltage is constant, so dv/dt = 0. Hence iC = C·dv/dt = 0. An ideal capacitor therefore behaves as an open circuit in DC steady state."
                ],
                "note": "The charging/discharging transient is outside the current R25 Unit I source set."
              },
              "answer_basis": [
                "u1-rlc"
              ]
            },
            {
              "id": "u1-sa-10",
              "number": 10,
              "book_page": 70,
              "topic_id": "u1-sources",
              "question": "Differentiate between independent and dependent voltage sources.",
              "answer": {
                "table": {
                  "headers": [
                    "Independent voltage source",
                    "Dependent voltage source"
                  ],
                  "rows": [
                    [
                      "Its specified voltage is set independently of other circuit variables.",
                      "Its voltage is controlled by another voltage or current elsewhere in the circuit."
                    ],
                    [
                      "Ideal source maintains the prescribed terminal voltage regardless of the current demanded by the connected circuit.",
                      "Its value changes according to its controlling-variable relationship, such as v = μvₓ or v = riₓ."
                    ]
                  ]
                }
              },
              "answer_basis": [
                "u1-sources"
              ]
            },
            {
              "id": "u1-sa-11",
              "number": 11,
              "book_page": 70,
              "topic_id": "u1-sources",